{
  "$schema": "https://json-schema.org/draft/2020-12/schema",
  "$id": "episode_spec.v001.json",
  "title": "PD episode machine contract",
  "description": "The numbers an episode commits to, in the one place every tool reads. Prose design documents stay as they are -- this is the layer a machine can check. Every field here exists because its absence caused a measured production failure; the failure is named in each description so nobody deletes a field without knowing what it cost.",
  "type": "object",
  "additionalProperties": false,
  "patternProperties": {
    "^_": {
      "description": "ANNOTATION KEYS. A leading underscore marks a note for humans -- why a number was chosen, who decided it, what was rejected. lacmegantic and uri each carried `_people_plates_note` and the whole pipeline REFUSED to build them for it, so the reasoning had to be deleted to make the episode buildable: the schema was making the constitution's own habit of recording why unusable. Underscore keys are read by nobody; an unknown key WITHOUT the underscore is still an error."
    }
  },
  "required": [
    "schema_version",
    "episode_id",
    "slug",
    "runtime_seconds",
    "script_words",
    "section_vocabulary",
    "figure_beats_per_act",
    "distinct_video_assets",
    "people_plates_min",
    "thumbnail_candidates_min",
    "footage_review_required",
    "audio_layers"
  ],
  "properties": {
    "schema_version": {
      "const": "1.0.0"
    },
    "episode_id": {
      "type": "string",
      "pattern": "^PD-\\d{4}-\\d{3}-[a-z0-9]+$"
    },
    "slug": {
      "type": "string",
      "pattern": "^[a-z0-9]+$"
    },
    "runtime_seconds": {
      "type": "array",
      "items": {
        "type": "number",
        "minimum": 1
      },
      "minItems": 2,
      "maxItems": 2,
      "description": "Finished-film band, low then high. WHY: EP50-59 declared nothing, so check_final_acceptance fell back to its 690-750s default and every 28-30 minute episode failed runtime_band. Eight of nine receipts carried that failure and it became background noise that hid real defects."
    },
    "script_words": {
      "type": "array",
      "items": {
        "type": "integer",
        "minimum": 1
      },
      "minItems": 2,
      "maxItems": 2,
      "description": "Narration word-count band. WHY: same fallback, same result -- 4,700-word scripts measured against a 1,575-2,141 band."
    },
    "section_vocabulary": {
      "type": "array",
      "items": {
        "type": "string"
      },
      "minItems": 3,
      "description": "The section names this episode's script actually uses, in order. WHY: structure_4part failed on 9 of 9 because it looked for an 'OPENING' section in scripts written to a five-act vocabulary."
    },
    "figure_beats_per_act": {
      "type": "array",
      "items": {
        "type": "integer",
        "minimum": 1
      },
      "minItems": 2,
      "maxItems": 2,
      "description": "Min and max on-screen motion-graphic beats per act. WHY: EP57 shipped 10 beats total and EP58/EP59 8, against 78-91 on their siblings; EP57 rendered at 0.37 kinetic beats per minute against a floor of 2.5 and the gate called it kamishibai. EP58 rendered for an hour on that empty data before anyone counted."
    },
    "distinct_video_assets": {
      "type": "integer",
      "minimum": 1,
      "description": "Distinct footage + motion assets required so no clip repeats. WHY: EP54 had 253 footage cuts and 188 distinct assets, so 65 clips ran twice and asset_reuse failed AFTER a two-hour render. Compute it as footage cuts, not as cuts divided by the reuse cap."
    },
    "people_plates_min": {
      "type": "integer",
      "minimum": 1,
      "description": "Minimum P### human plates. WHY: EP57 carried 2 where its siblings carry 7-16, in a film about one person's twenty-one days; EP60 carried 0."
    },
    "mandatory_stills": {
      "type": "array",
      "items": {
        "type": "string"
      },
      "description": "Stills that MUST appear in the film, by basename. WHY: EP54's fourteen purpose-made courtroom stills -- generated because the archive holds no courtroom footage at all -- were silently dropped because the builder trimmed a surplus pool from the alphabetical tail, then retired them as unreferenced."
    },
    "intentionally_empty_stills": {
      "type": "array",
      "items": {
        "type": "string"
      },
      "description": "Plate basenames the IMAGE ORDER asks to be empty -- a bare ground for text composited in Remotion, or a near-featureless field. WHY (2026-08-23, EP71 oroville): the manifest's near-black filter cannot tell these from a dead render, because there is genuinely nothing in them; O086's brief is 'plain deep ground, empty, for a single word set alone'. Plates that are dark but CARRY content need no declaration -- they are measured and kept. This list is only for the ones with nothing to measure, and every entry is a claim that somebody read the order."
    },
    "thumbnail_candidates_min": {
      "type": "integer",
      "minimum": 1,
      "description": "Thumbnails to build before choosing. WHY: thumbnail_ready wants at least three and a single Codex face plate produced one, so the gate failed at the very end of the run."
    },
    "footage_review_required": {
      "type": "boolean",
      "description": "Whether every staged clip must carry a recorded human verdict. WHY: write_factory_clip_qc stamped every clip reviewed/on_theme/accept unconditionally. When someone finally looked, 683 of 1,094 clips across five episodes were wrong for their story."
    },
    "audio_layers": {
      "type": "integer",
      "minimum": 1,
      "description": "Layers the finished mix is built from. WHY: sound_layers failed on 9 of 9 because it demands an audio_provenance artifact that no step in this pipeline produces. Declaring the real number forces that contradiction to be settled instead of waived every time."
    },
    "forbidden_subjects": {
      "type": "array",
      "items": {
        "type": "string"
      },
      "description": "Things this episode must never show, as lowercase keywords matched against footage titles, query terms and still names. WHY: EP60 forbids the collapse, rubble, rescue operations and casualties, and the footage queries written for it asked for exactly `rubble collapse`, `search and rescue`, `firefighter rescue`, `excavator debris` and `ambulance night`. Thirty-one clips were staged before a human noticed. Every episode carries constraints of this kind -- EP57 may not name the arresting officers or depict drug use, EP58 may not imply records were destroyed -- and until now there was nowhere machine-readable to put them, so they lived in prose that the asset tools never read."
    },
    "forbidden_claims": {
      "type": "array",
      "items": {
        "type": "string"
      },
      "description": "Assertions the record does not support, which must not appear in narration, captions or on-screen text. WHY: EP60 may not say the structure was at `half the required strength` (no readable source) or that the collapse took `13 seconds` (the pool deck fell more than four minutes before the tower, so no single duration exists)."
    },
    "ae_beats": {
      "type": "object",
      "additionalProperties": false,
      "required": ["min_count", "per_act_min", "screen_seconds_min", "jobs_file", "beats"],
      "properties": {
        "min_count": {"type": "integer", "minimum": 12},
        "per_act_min": {"type": "integer", "minimum": 1},
        "screen_seconds_min": {"type": "number", "minimum": 90},
        "jobs_file": {"type": "string", "pattern": "^scripts/ae/jobs_[a-z0-9]+\\.json$"},
        "gpu_accel": {"enum": ["SOFTWARE", "CUDA", "OPENCL"]},
        "beats": {
          "type": "array",
          "minItems": 12,
          "items": {
            "type": "object",
            "additionalProperties": false,
            "required": ["id", "act", "kind", "headline", "source"],
            "properties": {
              "id": {"type": "string", "pattern": "^AE[0-9]{3}$"},
              "act": {"type": "string", "minLength": 1},
              "kind": {"enum": ["hero_number", "document_blowup", "comparison", "timeline", "system_map", "quote_card", "map_move", "list_build", "title_card"]},
              "headline": {"type": "string", "minLength": 2, "maxLength": 60},
              "source": {"type": "string", "minLength": 8},
              "duration_sec": {"type": "number", "minimum": 1.5, "maximum": 20},
              "notes": {"type": "string"}
            }
          }
        }
      },
      "description": "Where After Effects appears in THIS film, declared at design time. Required from PD-2026-077 onward (decisions/0011, owner directive 2026-08-23 and its same-day clarification). WHY THE FLOORS ARE THESE NUMBERS, measured 2026-08-23 across the 26 episodes that carry a spec: the median episode declares 8 acts at 13-17 figure beats per act, i.e. 104-136 declared motion-graphic beats, and built film json carries 16-99 actual figures. The previous AE standard was PD_CANON section 6's 'one or two kinetic beats mid-film', which is 1-2 percent of that. min_count 12 puts AE at roughly a tenth of the declared beats and 6-12x the old standard, per_act_min 1 stops all twelve landing in one act, and screen_seconds_min 90 is 12 beats at the 7.5s a hero card needs to be read. These are floors for the DESIGN, not a promise that the beats rendered -- decisions/0011 requires a pixel-reading verify before the film json is built, and nothing here replaces it. `source` is the claim id, ledger row or script line the headline comes from: an AE card states a fact on screen, so it is subject to `factual_support` exactly like a title (rule 19), and a headline with no record behind it must be impossible to declare."
    },
    "notes": {
      "type": "string"
    },
    "revision_reason": {
      "type": "object",
      "additionalProperties": false,
      "required": ["revision", "supersedes", "date", "authority", "changes"],
      "properties": {
        "revision": {"type": "string", "pattern": "^v[0-9]{3}$"},
        "supersedes": {"type": "string", "pattern": "^v[0-9]{3}$"},
        "date": {"type": "string", "pattern": "^[0-9]{4}-[0-9]{2}-[0-9]{2}$"},
        "authority": {"type": "string", "minLength": 20},
        "changes": {
          "type": "array",
          "minItems": 1,
          "items": {
            "type": "object",
            "additionalProperties": false,
            "required": ["field", "old", "new", "arithmetic", "provenance_of_the_error"],
            "properties": {
              "field": {"type": "string"},
              "old": {},
              "new": {},
              "arithmetic": {"type": "string", "minLength": 40},
              "provenance_of_the_error": {"type": "string", "minLength": 40},
              "not_changed_because": {"type": "string"}
            }
          }
        },
        "unchanged": {"type": "array", "items": {"type": "string"}}
      },
      "description": "Present ONLY on a spec revision above v001, and it must say why. WHY: a declared value is a commitment, and the standing rule is that a threshold is never lowered to make something pass. The one legitimate reason to change one is that it was WRONG WHEN WRITTEN -- derived from an input that did not hold, or never derived at all. That claim has to be provable by a later reader, so this block carries the old value, the new value, the arithmetic that produced the new one, where the original error came from, the date, and the named owner decision that authorised it. A revision without this block is indistinguishable from moving the goalposts. Required sub-fields are deliberately hard to satisfy with a hand-wave: `arithmetic` and `provenance_of_the_error` both have minimum lengths. First used 2026-08-12 for EP66/EP67/EP69 distinct_video_assets."
    },
    "approved_deviations": {
      "type": "array",
      "items": {
        "type": "string"
      },
      "description": "Checks the owner has knowingly accepted for THIS episode. An entry here is a decision, not a default."
    },
    "target_cut_sec": {
      "type": "number",
      "minimum": 2.0,
      "maximum": 8.0,
      "description": "Average cut length this episode is cut to. WHY: the builder default of 4.6s fixes the cut count, and the cut count fixes how many stills can appear, because stills may occupy at most 32% of cuts under the video-share floor. EP61 commissioned 150 stills because the archive cannot supply a prison-and-courtroom film after 60 episodes (courtroom 23/24 already used, cell 20/24, prison 18/24); at 4.6s only 105 fit and check_spec_satisfied refuses. At 3.89s all 150 fit. This does NOT relax the video-share floor or any motion check -- a shorter cut changes the picture more often, which is the same direction as the standing rule against slideshows."
    },
    "people_plates": {
      "type": "array",
      "items": {
        "type": "string"
      },
      "description": "Plate ids that ARE this episode's people plates, e.g. ['G210.png', ...]. Declared because the filename does not carry that meaning: EP62-65 name people plates with the episode prefix, and check_episode_inputs used to count only names beginning with P, so it reported 0 of 10 on forty plates that exist and are correct."
    },
    "era_setting": {
      "type": "object",
      "additionalProperties": false,
      "required": ["place", "years"],
      "properties": {
        "place": {
          "type": "string",
          "minLength": 3,
          "description": "Where the story happens, most specific first, e.g. 'Louisville, Kentucky, USA'."
        },
        "country": {
          "type": "string",
          "description": "The country on its own, so a place marker in a clip's title can be compared against it."
        },
        "years": {
          "type": "array",
          "items": {"type": "integer", "minimum": 1000, "maximum": 2200},
          "minItems": 2,
          "maxItems": 2,
          "description": "First and last year the film depicts, inclusive."
        },
        "notes": {
          "type": "string"
        }
      },
      "description": "WHEN and WHERE this episode is set. WHY: EP62 greene shipped, past a green pre-flight, a green probe, a green post-render gate, forty green acceptance checks and a green pool QC, with two clips that cannot exist in it -- a modern US election ballot reading 'United States President and Vice President / VOTE FOR ONE' (filed person_holding_papers, used twice, the second time under the narration 'the only evidence anybody brought') and a modern European park with a 2011 Range Rover Evoque on an EU plate (filed playground, used twice, the first inside the opening minute). Neither was forbidden by anything, because nothing anywhere in the episode's machine contract said greene is 1975, Louisville, USA. forbidden_subjects lists what this story must not show; this says what CENTURY AND CONTINENT it is in, which is the constraint those two clips broke. check_pool_frames.py reads it and surfaces, FOR HUMAN ATTENTION ONLY, clips whose filename or ledger title suggests a modern vehicle, a mobile phone, a computer screen, foreign or EU signage, or legible political text when the era predates them. That surfacing is a reading order, not a detector: on the ballot clip it fires only on the word 'papers', and on the Evoque clip it fires nothing at all."
    }
  }
}
