{
  "schema_version": "1.0.0",
  "episode_id": "PD-2026-055-burge",
  "slug": "burge",
  "runtime_seconds": [
    1620,
    1920
  ],
  "script_words": [
    4400,
    4900
  ],
  "section_vocabulary": [
    "COLD OPEN",
    "OPENING",
    "ACT I",
    "ACT II",
    "ACT III",
    "ACT IV",
    "ENDING"
  ],
  "figure_beats_per_act": [
    13,
    17
  ],
  "distinct_video_assets": 234,
  "people_plates_min": 8,
  "mandatory_stills": [],
  "thumbnail_candidates_min": 3,
  "footage_review_required": true,
  "audio_layers": 2,
  "forbidden_subjects": [
    "torture",
    "gore",
    "electric shock",
    "suffocation"
  ],
  "forbidden_claims": [
    "burge was convicted of torture",
    "punished for torture",
    "learned torture in vietnam",
    "so-called victims"
  ],
  "notes": "Bands are the channel defaults. section_vocabulary read from EP55_burge_script.en.v001.md headings (four-act). No stills were generated for this episode to cover an archive gap, so mandatory_stills is empty rather than guessed. forbidden_subjects from EP55_burge_FACTS_LEDGER.v001.md BU-06 and the restraint block: 'Torture is NEVER depicted (visuals): objects, shadows, empty rooms, aftermath; no restrained person, no device touching anyone, no distress faces' and 'no gore'. forbidden_claims are the ledger's own verbatim bans: 'NEVER say or imply Burge was convicted of, or punished for, torture', 'never assert he learned torture in Vietnam as fact', and BU-30's unverified quote 'so-called victims'."
}
